{
  "schema_version": "1.0",
  "release_id": "v1-rc2",
  "created_at": "2026-08-21T15:07:59+08:00",
  "source_commit": "5054f44578b6c29d83601b513a0c3d6b98ae4ec2",
  "release_tag": "release-v1-rc2",
  "milestone_tag": "m8-corrected-v2",
  "evidence_level": "E1",
  "publication_status": "pending-publication",
  "site": {
    "base": "/about-harness/",
    "local_smoke_url": "http://127.0.0.1:4175/about-harness/",
    "published_url": null
  },
  "authorization": {
    "a3_used": false,
    "a4_used": true,
    "remote_operations": true
  },
  "review_rounds": [
    {
      "round": "01",
      "baseline_tag": "review-v1-round-01-baseline",
      "complete_tag": "review-v1-round-01-corrected-v1",
      "baseline_commit": "999a4c3a88409193b0ce0d9da3635e0c1054a1b8",
      "findings_commit": "9624c51775a6f85d5922ac9ddfcfbb11555334cc",
      "content_result_commit": "becedcda8efea213d8ac00b1e79348bdb7190002",
      "evidence_commit": "17c4b9c47ccdc7a56a5866f1ba27331944c4c3fe",
      "verification_sha256": "FA0218FE9BD5F22C690B0AD48D32F942AB9550CBDE6A9CC3E40E377A4982A52A"
    },
    {
      "round": "02",
      "baseline_tag": "review-v1-round-02-baseline",
      "complete_tag": "review-v1-round-02-complete",
      "baseline_commit": "17c4b9c47ccdc7a56a5866f1ba27331944c4c3fe",
      "findings_commit": "58c542af338f0406a0a56d6836f1d5890bc6b339",
      "content_result_commit": "ca9c6c9bed1499d4e9ab85adf44bc5d6e324296b",
      "evidence_commit": "d4603b08e5cd09851107864d991c5506be19f382",
      "verification_sha256": "3F9F1B99B3625390C6816533490B032FA09F05478B34E272728EA07178EFCE28"
    },
    {
      "round": "03",
      "baseline_tag": "review-v1-round-03-baseline",
      "complete_tag": "review-v1-round-03-complete",
      "baseline_commit": "d4603b08e5cd09851107864d991c5506be19f382",
      "findings_commit": "e94a6555ebf077747ce5e843a2fca3b663d626b6",
      "content_result_commit": "bcf22da2cb951c487e94146cb5eeb920e8521657",
      "evidence_commit": "916d9247bd8c42b3416c368b4b1e3fd4c7ed11ca",
      "verification_sha256": "4D47182F5B838782F719EE22920992A2F0A75F55C44F987808FBC6AB363F6502"
    },
    {
      "round": "04",
      "baseline_tag": "review-v1-round-04-baseline",
      "complete_tag": "review-v1-round-04-complete",
      "baseline_commit": "916d9247bd8c42b3416c368b4b1e3fd4c7ed11ca",
      "findings_commit": "47793e0ba3a11866c3fd1c864cc216cda5de60c6",
      "content_result_commit": "58777d93ae5dd29095239ef80b57777e006a5883",
      "evidence_commit": "252f75b1dc312ed446017e3f3bde777d1f6979c9",
      "verification_sha256": "699A4543A674C7140BE87DFD5E8A4A97F685DB7DF5847E0354B9454381C51011"
    },
    {
      "round": "05",
      "baseline_tag": "review-v1-round-05-baseline",
      "complete_tag": "review-v1-round-05-complete",
      "baseline_commit": "252f75b1dc312ed446017e3f3bde777d1f6979c9",
      "findings_commit": "f2b0637db9140f79f32a6f2352a5292c5ba7da5e",
      "content_result_commit": "350cba7288be0983364945361fe3f36e8745b0b7",
      "evidence_commit": "a4b8486b5fc0c8507af4b99cabb562cd64a11254",
      "verification_sha256": "2BADEF392F25D53FF56E4DC92136EF945C7FE256D4770E12FF2A23D2C941E15B"
    },
    {
      "round": "06",
      "baseline_tag": "review-v1-round-06-baseline",
      "complete_tag": "review-v1-round-06-complete",
      "baseline_commit": "a4b8486b5fc0c8507af4b99cabb562cd64a11254",
      "findings_commit": "99908455ff7ce99dc65d77e8d735761e5d6b1f4c",
      "content_result_commit": "3c3d0cf0d306f81b391a66334d62471681521009",
      "evidence_commit": "934015e6bafd57c0b3037c3f039e972180c54345",
      "verification_sha256": "E218D2B4D3760D6B62DF3B1FE822C7BC364498DC8021808F94DE0ECBC36EBC55"
    },
    {
      "round": "07",
      "baseline_tag": "review-v1-round-07-baseline",
      "complete_tag": "review-v1-round-07-complete",
      "baseline_commit": "934015e6bafd57c0b3037c3f039e972180c54345",
      "findings_commit": "93ee37676aedf196dcedf90a33bd0daa098aedb4",
      "content_result_commit": "7d9fbdd406da470595383733aaecec0266d2869c",
      "evidence_commit": "3bb6c1bf64082cc4f84927ba7419fe70f90359bc",
      "verification_sha256": "E83A11DF4026EE3820C539ADCA67E8EA2CEF034F9108697D0B061183AAE25E85"
    },
    {
      "round": "08",
      "baseline_tag": "review-v1-round-08-baseline",
      "complete_tag": "review-v1-round-08-complete",
      "baseline_commit": "3bb6c1bf64082cc4f84927ba7419fe70f90359bc",
      "findings_commit": "c0987dd7935b10f728afa37b7121d69b22c465e5",
      "content_result_commit": "95791a70634eeeec500d94261f9483d4d5c22218",
      "evidence_commit": "a8d45347fb837b4e4581ed7c43a38ead18f6d743",
      "verification_sha256": "E73CCAE191AFDB1A0D6D8DC96382D504D5909A5D356CECFD01020344A758A26D"
    },
    {
      "round": "09",
      "baseline_tag": "review-v1-round-09-baseline",
      "complete_tag": "review-v1-round-09-complete",
      "baseline_commit": "a8d45347fb837b4e4581ed7c43a38ead18f6d743",
      "findings_commit": "51c207bfa707dc8995960f4e2937d4e300d93cb8",
      "content_result_commit": "dc71b0dcdf2755a3c7738ce145211bf6ccc70919",
      "evidence_commit": "621ec3cb48569434a4f283275c7d2ab1083d33c2",
      "verification_sha256": "44146609C8C990247BC8D357CCF7A5395409CB2A4AC397039DE1D3F5649BCD89"
    },
    {
      "round": "10",
      "baseline_tag": "review-v1-round-10-baseline",
      "complete_tag": "review-v1-round-10-complete",
      "baseline_commit": "621ec3cb48569434a4f283275c7d2ab1083d33c2",
      "findings_commit": "6294de1d15533538ed244b17e4ac08314f9ac038",
      "content_result_commit": "dc67e6b68f8f3d5587cff04ca53a0de22b457f32",
      "evidence_commit": "5054f44578b6c29d83601b513a0c3d6b98ae4ec2",
      "verification_sha256": "6372789A74D72DF88A682F75C161A24F40BE26339E9EA0C364C821549616F1FA"
    }
  ],
  "facts": {
    "as_of": "2026-08-21",
    "max_age_days": 30,
    "verified_claims": 16,
    "stale_high": 0
  },
  "reports": {
    "facts_registry": "docs/references/fact-registry.md",
    "licenses": ["LICENSE", "LICENSE-DOCS"],
    "privacy": "docs/meta/privacy.md",
    "dependency_security": "docs/meta/dependency-security.md",
    "workflows": [".github/workflows/ci.yml", ".github/workflows/deploy.yml", ".github/workflows/facts.yml"],
    "publication_scope": [
      "package.json",
      "docs/.vitepress/config.mts",
      "docs/.vitepress/publication-scope.mjs",
      "scripts/check-built-site.mjs",
      "scripts/pages-smoke.mjs",
      "scripts/serve-pages.mjs"
    ],
    "visual_manifests": ["artifacts/visual/m6/manifest.json", "artifacts/visual/round-09/manifest.json"],
    "public_results": ["lab/results/public/m5-offline-summary.json", "lab/results/public/m5-offline-trace-sample.json"]
  },
  "known_limitations_path": "artifacts/release/v1/known-limitations.md",
  "verification_path": "artifacts/release/v1/verification.json",
  "artifact_hashes": {
    "lab/schemas/release-candidate.schema.json": "6D7D680C68F9D7B7D2AF97F9B31CF956D3524830D82EA02D5517F21D6B2AF75B",
    "artifacts/release/v1/verification.json": "D11DF176DBE70597DF708A0C562AF674243349B86C189F12F33F6B96C7DF7E91",
    "artifacts/release/v1/known-limitations.md": "99C072EBB772DCE348FDBB40DB93A86DC05D27531A6A579B620552D18C4A960A",
    "docs/references/fact-registry.md": "B1918BA304C2A88F82B1947182755F62693A8A4A2C4A999D7B02C17A5C1A7DED",
    "LICENSE": "43323F0A35F2FFF272C6C8349A19BFCCCDA39C1D8ADD8FC00502A320458F3940",
    "LICENSE-DOCS": "E35821A79472205FAFF37A9F63D06FD5ED20F71F089537E92577A773693AF731",
    "docs/meta/privacy.md": "6D9E5C212C243FFF1DE6A0259C55913E124D877A1A852269B680AF44E247D52F",
    "docs/meta/dependency-security.md": "53BFF031E14CE67FBC67B9FB28F6A03C8148AA23A851D91DABFAFE224B4C722E",
    ".github/workflows/ci.yml": "B48AE49ED79CC0F53AE3832A9D2B71662FC6530B208E8352915B901983934808",
    ".github/workflows/deploy.yml": "344D9968E7E2E2C11AA56B3546739BFF04C44627D4F9822E70792C99B1DB73DE",
    ".github/workflows/facts.yml": "D879A3C3151CEA34A99843488245A125664267085308F41879728F4A76048CFB",
    "package.json": "497D527DF445A171399C859E1F8190AB7FB01DD88D91615BE615DC3809F1287C",
    "docs/.vitepress/config.mts": "84D961E9D00B094551B7F40B49C6CF2201D011DC53CA1ADA2878F14EC9681CFA",
    "docs/.vitepress/publication-scope.mjs": "37AEE8E67DC57BDA829322889D95FFAF097C8EFD870EA10952558A1403156436",
    "scripts/check-built-site.mjs": "6020167D9CA5BB2B4F4BCC943256D73FB86DDDC8939626B7548BF19F3CBB822D",
    "scripts/pages-smoke.mjs": "BFAE97BBCD2CE75F3F04EC9A66A5FE3261798736CF957D1B3D30A43E05190219",
    "scripts/serve-pages.mjs": "C155B5272CEC7610796D4C76C6B5B97072AC3458E0A88843FF7E85577EA30CAD",
    "artifacts/visual/m6/manifest.json": "D472EC5DA357A0BBE0119821B036EFE9977D9426A93BA6E3AAA066B7B58AE749",
    "artifacts/visual/round-09/manifest.json": "50BBE6BA625147B6D3DF4FCDABD51FC7E0E9490917AABD5924261A192C45A586",
    "lab/results/public/m5-offline-summary.json": "15BAF225F8F8FB77A8DECDDE837F2D932B0DC37EA9F07A189A2AB17159DDA474",
    "lab/results/public/m5-offline-trace-sample.json": "E558DA616FDD86FE4D3779D473F607536C11A4536AF55310BD20E327727D37B6"
  }
}
